Source,Regular_Expression,Match,Manual_Verification,SMILES,Drug_Name,Class
https://doi.org/10.1038/s41413-021-00144-2,.*does not cross the blood.brain barrier.*,"16 Importantly, dopamine does not cross the blood–brain barrier; thus, intravenous administration does not deliver dopamine to the brain",Duplicate,C1=CC(=C(C=C1CCN)O)O,dopamine,0
https://doi.org/10.1186/s12933-018-0702-3,.*does not cross the blood.brain barrier.*," These peptides are not affected in samples from linagliptin-treated control mice, which is in line with the observation that linagliptin does not cross the blood brain barrier under physiological conditions [55]",Duplicate,CC#CCN1C2=C(N=C1N3CCC[C@H](C3)N)N(C(=O)N(C2=O)CC4=NC5=CC=CC=C5C(=N4)C)C,linagliptin,0
https://doi.org/10.1038/s41467-018-05283-5,.*does not cross the blood.brain barrier.*," However, it is unlikely that this is a direct effect, as dopamine does not cross the blood brain barrier (BBB), raising the question of how the signal is transmitted from the brain to the tumor",Duplicate,C1=CC(=C(C=C1CCN)O)O,dopamine,0
https://doi.org/10.1186/s12929-018-0428-2,.*does not cross the blood.brain barrier.*," As dopamine does not cross the blood-brain barrier, therefore its administration is not possible, so levodopa bypassing this barrier may be rapidly decarboxylated and transformed by enzymes into dopamine, hence it becomes the choice of therapeutic drug administration in order to minimize cognitive and motor deficits resulting from low dopaminergic levels [71]",Duplicate,C1=CC(=C(C=C1CCN)O)O,dopamine,0
https://doi.org/10.1007/s00018-017-2691-x,.*inability to cross the blood.brain barrier.*,The key limitation of NTs in the treatment of PNS and CNS diseases is their inability to cross the blood–brain barrier,Fail,-,,
https://doi.org/10.1038/s41598-017-12422-3,.*does not cross the blood.brain barrier.*," Another study found no correlation between exercise-induced increases in systemic dopamine and improvements in motor learning32, but acknowledged that dopamine does not cross the blood-brain barrier in appreciable amounts and that systemic levels do not necessarily reflect cortical levels31",Duplicate,C1=CC(=C(C=C1CCN)O)O,dopamine,0
https://doi.org/10.1038/modpathol.2016.158,.*does not cross the blood.brain barrier.*," Because dopamine does not cross the blood–brain barrier, they hypothesized involvement of the sympathetic nervous system",Duplicate,C1=CC(=C(C=C1CCN)O)O,dopamine,0
https://doi.org/10.1038/srep11078,.*does not cross the blood.brain barrier.*, Dopamine as such does not cross the blood brain barrier whereas L-dopa does and in the central nervous system dopa decarboxylase converts it into dopamine,Duplicate,C1=CC(=C(C=C1CCN)O)O,Dopamine,0
https://doi.org/10.1038/s41598-018-22162-7,.*does not cross the blood.brain barrier.*, It chelates cholesterol but does not cross the blood brain barrier (BBB)26,Fail,-,,
https://doi.org/10.1007/s00702-017-1708-9,.*does not cross the blood.brain barrier.*," As 6-OHDA does not cross the blood–brain barrier (BBB), it is stereotaxically injected directly into the right or left striatum, medial forebrain bundle or substantia nigra, inducing unilateral motor impairments",Duplicate,C1=C(C(=CC(=C1O)O)O)CCN,6-OHDA,0
https://doi.org/10.1007/s00702-013-0981-5,.*does not cross the blood.brain barrier.*,Dopamine does not cross the blood–brain barrier,Duplicate,C1=CC(=C(C=C1CCN)O)O,Dopamine,0
https://doi.org/10.1203/00006450-199706000-00006,.*does not cross the blood.brain barrier.*," In adults, dopamine does not cross the blood-brain barrier(26), but this barrier develops gradually in children until about 6 mo of age(27)",Duplicate,C1=CC(=C(C=C1CCN)O)O,dopamine,0
https://doi.org/10.1038/s41440-021-00643-z,.*does not cross the blood.brain barrier.*," The selective APA inhibitor EC33 does not cross the blood-brain barrier; therefore, researchers have developed systemically active prodrugs",Pass,-,EC33,0
https://doi.org/10.1186/s40409-018-0139-x,.*unable to cross the blood.brain barrier.*," Because, they say, at least in adult individuals, the venom would be unable to cross the blood-brain barrier",Fail,-,,
https://doi.org/10.1186/s40409-018-0139-x,.*unable to cross the blood.brain barrier.*," According to Freire-Maia and Campos [31], the central effects would be the result and not the cause of the envenoming process, since the venom would be unable to cross the blood-brain barrier",Fail,-,,
https://doi.org/10.1007/s40089-014-0094-7,.*does not cross the blood.brain barrier.*," For example, doxorubicin does not cross the blood–brain barrier, but its integration with polysorbate 80 modified polybutylcyanoacrylate nanoparticles can increase its delivery to the brain to a significant extent [28]",Duplicate,C[C@H]1[C@H]([C@H](C[C@@H](O1)O[C@H]2C[C@@](CC3=C2C(=C4C(=C3O)C(=O)C5=C(C4=O)C(=CC=C5)OC)O)(C(=O)CO)O)N)O,doxorubicin,0
https://doi.org/10.1186/s13550-018-0358-8,.*does not cross the blood.brain barrier.*," Assuming that RG7356 does not cross the blood–brain barrier, this value is determined by the blood volume fraction of the brain",Fail,-,,
https://doi.org/10.1038/s41387-017-0015-8,.*inability to cross the blood.brain barrier.*," Natural anorexigenic neuropeptides have that potential, but their major disadvantage is their low stability in plasma and inability to cross the blood brain barrier (BBB) after peripheral administration",Fail,-,,
https://doi.org/10.1203/01.PDR.0000127012.37315.36,.*does not cross the blood.brain barrier.*," As enalaprilat does not cross the blood-brain barrier (31), the effects observed after systemic administration of this ACE-I represent the role of peripherally derived AngII on cardiovascular function",Pass,C[C@@H](C(=O)N1CCC[C@H]1C(=O)O)N[C@@H](CCC2=CC=CC=C2)C(=O)O,enalaprilat,0
https://doi.org/10.1038/s41467-017-01881-x,.*does not cross the blood.brain barrier.*," for 7 days with cocaine methiodide (CocMet), a cocaine analog that does not cross the blood brain barrier, to assess the effects of peripheral cocaine on G-CSF",Duplicate,C[N+]1([C@H]2CC[C@@H]1[C@H]([C@H](C2)OC(=O)C3=CC=CC=C3)C(=O)OC)C.[I-],cocaine methiodide,0
https://doi.org/10.1038/s41467-017-01881-x,.*does not cross the blood.brain barrier.*," To this end, mice were injected daily with cocaine methiodide–a charged analog of cocaine that does not cross the blood-brain barrier25 (Fig",Duplicate,C[N+]1([C@H]2CC[C@@H]1[C@H]([C@H](C2)OC(=O)C3=CC=CC=C3)C(=O)OC)C.[I-],cocaine methiodide,0
https://doi.org/10.1038/s41467-017-01881-x,.*does not cross the blood.brain barrier.*,To assess the effects of peripheral cocaine on expression of G-CSF in both the periphery and the CNS we utilized the charge cocaine analog cocaine methiodide—which does not cross the blood brain barrier25 to dissociate central vs,Duplicate,C[N+]1([C@H]2CC[C@@H]1[C@H]([C@H](C2)OC(=O)C3=CC=CC=C3)C(=O)OC)C.[I-],cocaine methiodide,0
https://doi.org/10.1186/s12974-019-1580-7,.*does not cross the blood.brain barrier.*, DSS does not cross the blood–brain barrier because of its higher molecular weight,Duplicate,-,DSS,0
https://doi.org/10.1186/s12974-015-0281-0,.*does not cross the blood.brain barrier.*," DSS is a large molecule (molecular weight (MW) 30,000 to 50,000) that does not cross the blood-brain barrier",Duplicate,-,DSS,0
https://doi.org/10.1007/s13311-017-0598-8,.*does not cross the blood.brain barrier.*," [112] demonstrated that treating male and female Siberian hamsters with enrofloxacin, a broad-spectrum fluoroquinolone antibiotic that does not cross the blood–brain barrier, reduced aggression in both male and female mice [112]",Pass,CCN1CCN(CC1)C2=C(C=C3C(=C2)N(C=C(C3=O)C(=O)O)C4CC4)F,enrofloxacin,0
https://doi.org/10.1203/PDR.0b013e3181fcbef3,.*does not cross the blood.brain barrier.*,It has been reported that EPO does not cross the blood-brain barrier in a detectable amounts when given at doses appropriate for erythropoiesis (200–400 U/kg) (32),Pass,CCCCC1=NC(=C(N1CC2=CC=C(C=C2)C3=CC=CC=C3C4=NN=N[N-]4)CO)Cl.[K+],EPO,0
https://doi.org/10.1186/s12871-015-0154-1,.*does not cross the blood.brain barrier.*," Esmolol, unlike propranolol [23], has no analgesic activity, is believed to have minimal sedative effects and given its low lipid solubility does not cross the blood–brain barrier in significant amounts [20, 24]",Pass,CC(C)NCC(COC1=CC=C(C=C1)CCC(=O)OC)O,Esmolol,0
https://doi.org/10.1186/s13024-017-0227-3,.*inability to cross the blood.brain barrier.*, This is thought to be related to the small amount of growth factor that effectively reached the central nervous system (CNS) either because of an inability to cross the blood brain barrier or because of the short half-life after intravenous injection [112],Fail,-,,
https://doi.org/10.1186/s10194-021-01333-4,.*does not cross the blood.brain barrier.*," Erenumab is a large molecule that does not cross the blood brain barrier and therefore it is thought to directly act on peripheral sensitization [59, 60], even if it is not possible to totally exclude it may have additional central effects [61]",Pass,-,Erenumab,0
https://doi.org/10.1007/s10286-020-00714-0,.*does not cross the blood.brain barrier.*, Fenoldopam is a catechol-containing DRD1 partial agonist that does not cross the blood-brain barrier,Pass,C1CNCC(C2=CC(=C(C(=C21)Cl)O)O)C3=CC=C(C=C3)O,Fenoldopam,0
https://doi.org/10.1186/s12868-019-0529-1,.*unable to penetrate the blood.brain barrier.*," Etanercept is such a large molecule that it is usually unable to penetrate the blood–brain barrier (BBB) [24], but the several studies have demonstrated that the BBB could be disrupted by LPS exposure [25, 26]",Pass,-,Etanercept,0
https://doi.org/10.1186/s41824-019-0071-5,.*does not cross the blood.brain barrier.*," In contrary to FDG, FLT does not cross the blood-brain barrier if intact (Nikaki et al",Pass,CC1=CN(C(=O)NC1=O)[C@H]2C[C@@H]([C@H](O2)CO)F,FLT,0
https://doi.org/10.1038/cddis.2012.59,.*does not cross the blood.brain barrier.*," Intravenous administration of basic fibroblast growth factor, which does not cross the blood–brain barrier, known to protect endothelial cells against apoptosis after irradiation also attenuated the apoptotic response of NPCs",Pass,-,fibroblast growth factor,0
https://doi.org/10.1007/s13311-016-0455-1,.*does not penetrate the blood.brain barrier.*, These findings are important given that etanercept does not penetrate the blood–brain barrier when administered systemically,Duplicate,-,etanercept,0
https://doi.org/10.1186/s10194-017-0811-5,.*unable to penetrate the blood.brain barrier.*," In line with this, few preclinical studies revealed that humanized CGRP mAb are (i) unable to penetrate the blood-brain barrier in the perfused MCA [77]; (ii) ineffective in inhibiting the responses to CGRP-induced neurogenic vasodilation of the pial artery [78]; and (iii) capable of inhibiting CGRP-induced neurogenic vasodilation of the MMA, which as mentioned above lacks blood-brain barrier [65, 79]",Fail,-,,
https://doi.org/10.1007/s13311-017-0570-7,.*unable to cross the blood.brain barrier.*,"Prevention of T cell entry into the central nervous system may preclude their function in the setting of natalizumab use, noting the leading theory for natalizumab-associated PML is that of decreased immunosurveillance—hypothesizing that when T cells are sequestered in the periphery and unable to cross the blood–brain barrier to reach JCV-infected cells the virus can propagate in brain tissue [69, 70]",Fail,-,,
https://doi.org/10.1186/1471-2377-8-27,.*does not cross the blood.brain barrier.*, Etanercept does not cross the blood-brain barrier when administered systemically [59],Duplicate,-,Etanercept,0
https://doi.org/10.1038/s41598-018-32733-3,.*does not pass through the blood.brain barrier.*, GABA does not pass through the blood-brain barrier (BBB) making it ill-suited to inhibit the spreading of autoreactivity within the CNS,Pass,C(CC(=O)O)CN,GABA,0
https://doi.org/10.1186/1471-2202-10-41,.*does not cross the blood.brain barrier.*," As the Fluorogold does not cross the blood-brain barrier, this procedure only labels cells in the brain that project to areas that come into contact with fenestrated capillaries [27]",Pass,-,Fluorogold,0
https://doi.org/10.1038/s41598-017-11302-0,.*inability to cross the blood.brain barrier.*, The most important reported reason for the failure of most inhibitors during the clinical trials was their inability to cross the blood-brain barrier to penetrate and distribute inside neurons,Fail,-,,
https://doi.org/10.1186/s13041-018-0401-8,.*does not cross the blood.brain barrier.*," Previous reports indicated that FNDC5 does not cross the blood brain barrier, suggesting that FNDC5 in the brain may not be derived from the peripheral tissue",Pass,-,FNDC5,0
https://doi.org/10.1038/gim.2016.223,.*does not cross the blood.brain barrier.*, The mechanism of attenuation is unclear because ERT does not cross the blood–brain barrier,Fail,-,,
https://doi.org/10.1186/s12936-017-1994-6,.*unable to cross the blood.brain barrier.*, Furthermore the drug is unable to cross the blood–brain barrier [21],Fail,-,,
https://doi.org/10.1038/s41598-017-05938-1,.*does not cross the blood.brain barrier.*,"21, 22 showed that treatment with anti-TNFα, which does not cross the blood-brain barrier, acting only peripherally, prevents the induction of inflammation, neuroinflammation and cognitive and motor alterations in rats with MHE due to portacaval anastomosis",Fail,-,,
https://doi.org/10.1038/aps.2014.1,.*does not cross the blood.brain barrier.*, Glu also does not cross the blood brain barrier and hence is not delivered to the CNS through the ingestion of food,Pass,C(CC(=O)O)[C@@H](C(=O)O)N,Glu,0
https://doi.org/10.1038/aps.2013.20,.*does not penetrate the blood.brain barrier.*," The longer galanin 1–16 peptide has greater stability (half-life: 2–5 min in the circulation) and was employed in some studies, but it does not penetrate the blood-brain barrier (BBB)38",Pass,-,galanin 1–16 peptide,0
https://doi.org/10.1186/s13024-017-0154-3,.*does not cross the blood.brain barrier.*," As results from the enzyme-replacement therapies in GD show that GCase does not cross the blood-brain barrier (BBB), the development of small-molecule chaperones to correct the folding of GCase - thereby enhancing GCase activity and lysosomal function - is currently a topic of great interest [148]",Pass,-,GCase,0
https://doi.org/10.1186/s12943-017-0679-7,.*unable to cross the blood.brain barrier.*," Although it is likely playing a critical role in the brain, tumour targeted delivery or the use of inhibitors that are unable to cross the blood-brain barrier may present as viable future therapeutic options",Fail,-,,
https://doi.org/10.1186/s13023-017-0670-9,.*inability to cross the blood.brain barrier.*," However, ERTs generally have shortcomings such as inconvenient intravenous administration, inability to cross the blood-brain barrier, and high cost",Fail,-,,
https://doi.org/10.1186/s13023-017-0662-9,.*unable to cross the blood.brain barrier.*, It is not recommended for the severe Hurler form because the enzyme is unable to cross the blood-brain barrier,Fail,-,,
https://doi.org/10.1186/s13023-017-0662-9,.*inability to cross the blood.brain barrier.*," ERT may also significantly improve pre-transplant clinical conditions despite its inability to cross the blood-brain barrier and therefore absent/limited beneficial effect on cognitive functions [6, 45]",Fail,-,,
https://doi.org/10.1186/s40734-017-0054-2,.*does not cross the blood.brain barrier.*," ERT is based on the intravenous administration of recombinant GCase, which does not cross the blood-brain barrier [11]",Fail,-,,
https://doi.org/10.1038/npp.2016.103,.*does not cross the blood.brain barrier.*," However, it must be noted that GABA does not cross the blood brain barrier",Duplicate,C(CC(=O)O)CN,GABA,0
https://doi.org/10.1007/s12035-014-8726-5,.*does not cross the blood.brain barrier.*," In general, GABA does not cross the blood-brain barrier [129]",Duplicate,C(CC(=O)O)CN,GABA,0
https://doi.org/10.1007/s00213-017-4593-x,.*does not cross the blood.brain barrier.*," Thus, rats will self-administer cocaine methiodide, a quaternary derivative of cocaine that does not cross the blood brain barrier, only if they have had previous experience of self-administering cocaine (Wang et al",Duplicate,C[N+]1([C@H]2CC[C@@H]1[C@H]([C@H](C2)OC(=O)C3=CC=CC=C3)C(=O)OC)C.[I-], cocaine methiodide,0
https://doi.org/10.1038/sj.npp.1301023,.*does not cross the blood.brain barrier.*, Any effect of Gd-DTPA on the data sampled from the selected brain volume is expected to be negligible because Gd-DTPA does not cross the blood–brain barrier under normal conditions,Pass,-,Gd-DTPA,0
https://doi.org/10.1038/oncsis.2017.33,.*does not cross the blood.brain barrier.*," We also discover that THZ1, in its current format, does not cross the blood–brain barrier and hence will require reformatting for use as an HGG therapeutic",Duplicate,CN(C)C/C=C/C(=O)NC1=CC=C(C=C1)C(=O)NC2=CC=CC(=C2)NC3=NC=C(C(=N3)C4=CNC5=CC=CC=C54)Cl,THZ1,0
https://doi.org/10.1038/srep46461,.*does not cross the blood.brain barrier.*," There is increasing evidence that endogenous apolipoprotein E(apoE) modifies the neuroinflammatory response through its role in downregulating glial activation, however, the intact apoE holoprotein does not cross the blood-brain barrier due to its size",Fail,-,,
https://doi.org/10.1038/s41598-018-35716-6,.*does not cross the blood.brain barrier.*," We also provide evidence that GDF11 does not cross the blood brain barrier (BBB) and that the endothelial cells of the cerebral vasculature are responsive to GDF11, suggesting that GDF11 exerts at least a portion of its CNS effects through the vasculature",Pass,-,GDF11,0
https://doi.org/10.1038/pr.2017.243,.*does not cross the blood.brain barrier.*," For example, in contrast to EPO and BDNF, GDNF does not cross the blood–brain barrier, which makes exogenous administration of GDNF more difficult (61)",Pass,-,GDNF,0
https://doi.org/10.1007/s11940-017-0449-2,.*unable to cross the blood.brain barrier.*,"It has been of dispute whether immune checkpoint inhibitors can reveal their full therapeutic potential in BM, as these monoclonal antibodies with a large molecular weight are unable to cross the blood brain barrier [8, 9]",Fail,-,,
https://doi.org/10.1186/1471-230X-5-5,.*does not cross the blood.brain barrier.*, With regard to the characteristic physiological feature that peripheral ghrelin does not cross the blood-brain barrier in rodents it is important to note that the arcuate nucleus is the only hypothalamic structure located outside the brain-blood barrier [30],Pass,-,ghrelin,0
https://doi.org/10.1186/s12974-017-0804-y,.*does not cross the blood.brain barrier.*, This compound does not cross the blood brain barrier [30] so that centrally mediated effects can be excluded,Fail,-,,
https://doi.org/10.1038/srep41382,.*does not cross the blood.brain barrier.*," Although peripheral glutamate does not cross the blood-brain barrier (BBB) under normal conditions18, pathological conditions may increase BBB permeability and allow for bidirectional glutamate transport",Fail,-,,
https://doi.org/10.1186/s13195-016-0231-9,.*does not cross the blood.brain barrier.*,Exactly how the relative ratio of apoE4 over apoE3 isoform levels in plasma can be related to the described structural and metabolic differences in the brain is not clear and linking peripheral apoE levels to processes in the brain is controversial because peripheral apoE does not cross the blood–brain barrier (BBB) [48],Fail,-,,
https://doi.org/10.1007/s11064-015-1675-1,.*does not cross the blood.brain barrier.*," Under normal circumstances, glutamate does not cross the blood–brain barrier [45]",Pass,C(CC(=O)[O-])C(C(=O)[O-])[NH3+],glutamate,0
https://doi.org/10.1007/s11095-009-9939-6,.*does not cross the blood.brain barrier.*," However, GDNF does not cross the blood-brain barrier (BBB)",Duplicate,-,GDNF,0
https://doi.org/10.1007/s11095-008-9815-9,.*does not cross the blood.brain barrier.*," However, GDNF does not cross the blood–brain barrier (BBB) (4,5)",Duplicate,-,GDNF,0
https://doi.org/10.1007/s13311-020-00897-4,.*does not cross the blood.brain barrier.*," The anticholinergic glycopyrrolate circumnavigates the risk of cognitive impairment because it does not cross the blood–brain barrier, but it still can produce peripherally mediated adverse effects such as urinary retention and constipation",Pass,C[N+]1(CCC(C1)OC(=O)C(C2CCCC2)(C3=CC=CC=C3)O)C.[Br-],glycopyrrolate,0
https://doi.org/10.1186/s13063-020-4089-6,.*inability to cross the blood.brain barrier.*," Glycopyrronium bromide was selected as placebo for this trial given it has similar antimuscarinic properties to scopolamine hydrobromide but an inability to cross the blood–brain barrier, thereby hypothetically mimicking only the peripheral effects of scopolamine",Pass,C[N+]1(CCC(C1)OC(=O)C(C2CCCC2)(C3=CC=CC=C3)O)C,Glycopyrronium bromide,0
https://doi.org/10.1038/npp.2016.134,.*does not cross the blood.brain barrier.*," The aromatic L-amino acid decarboxylase (AADC) inhibitor benserazide, which does not cross the blood–brain barrier, was used to prevent the 5-HT syndrome induced by 5-HTP peripheral metabolism (Hedge et al, 1994)",Fail,-,,
https://doi.org/10.1038/srep38305,.*does not cross the blood.brain barrier.*," Currently, exogenous enzyme replacement using recombinant alpha-L-iduronidase is available to patients with MPS-I, although it does not cross the blood brain barrier in significant amounts2",Fail,-,,
https://doi.org/10.1038/nmicrobiol.2016.226,.*inability to cross the blood.brain barrier.*," While these lethal models have value for vaccine and immunotherapeutic testing29, small-molecule inhibitors that are effective in the lung may be limited in their efficacy due to an inability to cross the blood–brain barrier30",Fail,-,,
https://doi.org/10.1186/s12958-018-0400-8,.*does not cross the blood.brain barrier.*," For this purpose, we used guanethidine monosulfate (GTD) as a pharmacological tool that destroys only peripheral noradrenergic fibers [27], as GTD does not cross the blood-brain barrier [28]",Pass,C1CCCN(CCC1)CCN=C(N)N.OS(=O)(=O)O,guanethidine monosulfate,0
https://doi.org/10.1038/sj.npp.1300586,.*does not cross the blood.brain barrier.*," Hexamethonium, which does not cross the blood–brain barrier, was tested at a dose that was higher than the highest ineffective dose (3 mg/kg/s",Pass,C[N+](C)(C)CCCCCC[N+](C)(C)C,Hexamethonium,0
https://doi.org/10.1038/labinvest.2016.98,.*does not cross the blood.brain barrier.*," Because dopamine does not cross the blood–brain barrier, they hypothesized involvement of the sympathetic nervous system",Duplicate,C1=CC(=C(C=C1CCN)O)O,dopamine,0
https://doi.org/10.1038/pr.2016.117,.*does not cross the blood.brain barrier.*, These findings suggest that there may exist a “compartmentalization” of cytokine responses whereas cytokines produced in response to noncentral nervous system infection which does not cross the blood-brain barrier,Fail,-,,
https://doi.org/10.1038/tp.2016.200,.*unable to cross the blood.brain barrier.*," Although surprising, this peripheral QA is unable to cross the blood–brain barrier and therefore has no direct impact on central QA concentrations and does not contribute to the behavioral phenotype of HAAO−/− mice",Fail,-,,
https://doi.org/10.1186/s12974-016-0710-8,.*does not cross the blood.brain barrier.*," Due to its large size, anti-TNF-α does not cross the blood–brain barrier, suggesting that its beneficial effects are a consequence of reduced peripheral inflammation",Fail,-,,
https://doi.org/10.1186/s13063-020-4089-6,.*does not cross the blood.brain barrier.*," As such, the present study will use glycopyrrolate as the active placebo as it is a muscarinic antagonist that does not cross the blood–brain barrier and should consequently mimic the peripheral muscarinic effects of scopolamine leading to superior blinding to saline (as previously used) [5–9]",Duplicate,C[N+]1(CCC(C1)OC(=O)C(C2CCCC2)(C3=CC=CC=C3)O)C.[Br-],glycopyrrolate,0
https://doi.org/10.1038/srep30745,.*does not cross the blood.brain barrier.*," As a quaternary ammonium derivative, this drug does not appear to affect the CNS because it does not cross the blood-brain barrier (BBB)34",Fail,-,,
https://doi.org/10.1007/s10585-016-9796-8,.*does not cross the blood.brain barrier.*," This has been shown in breast cancer patients who relapsed with brain metastases that were being treated with an antibody that does not cross the blood–brain barrier [68], or in pancreatic ductal adenocarcinoma where drug penetration is poor due to an extensive stromal envelope [69]",Fail,-,,
https://doi.org/10.1038/srep30275,.*unable to cross the blood.brain barrier.*," To recognize the IP substrate the catalytic cavity is a highly polar pocket which favors polar charged compounds, typically unable to cross the blood-brain barrier (BBB)19",Fail,-,,
https://doi.org/10.1007/s41981-018-0015-4,.*does not pass through the blood.brain barrier.*, Glycopyrrolate displays few side effects because it does not pass through the blood brain barrier,Duplicate,C[N+]1(CCC(C1)OC(=O)C(C2CCCC2)(C3=CC=CC=C3)O)C.[Br-],Glycopyrrolate,0
https://doi.org/10.1007/s12630-017-0920-2,.*does not cross the blood.brain barrier.*," Importantly, glycopyrrolate does not cross the blood brain barrier and therefore does not cause CNS anticholinergic toxicity as with atropine",Duplicate,C[N+]1(CCC(C1)OC(=O)C(C2CCCC2)(C3=CC=CC=C3)O)C.[Br-],glycopyrrolate,0
https://doi.org/10.1038/leu.2016.57,.*inability to cross the blood.brain barrier.*, Another potential limitation common for therapeutic antibodies is their inability to cross the blood–brain barrier,Fail,-,,
