Source,Regular_Expression,Match,Manual_Verification,SMILES,Drug_Name,Class
https://doi.org/10.1038/sj.npp.1301585,.*does not cross the blood.brain barrier.*," Although the systemic administration of scopolamine did not allow regional localization of this effect, the absence of an effect by methylscopolamine (which does not cross the blood–brain barrier) demonstrated central mechanisms (Chen et al, 2004)",Pass,C[N+]1([C@@H]2CC(C[C@H]1[C@H]3[C@@H]2O3)OC(=O)[C@H](CO)C4=CC=CC=C4)C,methylscopolamine,0
https://doi.org/10.1186/1744-8069-8-54,.*does not cross the blood.brain barrier.*," As mibefradil does not cross the blood–brain barrier, this antihyperalgesic effect is thought to be largely localized to the primary afferent neuron [4–6]",Pass,CC(C)[C@H]1C2=C(CC[C@@]1(CCN(C)CCCC3=NC4=CC=CC=C4N3)OC(=O)COC)C=C(C=C2)F,mibefradil,0
https://doi.org/10.1007/s40124-013-0033-5,.*inability to penetrate the blood.brain barrier.*,"Other than age-related biological diversity, another explanation for the lack of current pharmacotherapy in pediatric HGGs reflects an inability to penetrate the blood-brain barrier, with chemotherapy efflux occurring secondary to inherent drug transporter molecules, thereby conferring apparent resistance [75, 76]",Fail,-,,
https://doi.org/10.1007/s10286-017-0434-6,.*does not cross the blood.brain barrier.*," Note that midodrine does not cross the blood-brain barrier, and its use, as with fludrocortisone and droxidopa, is associated with supine hypertension",Pass,COC1=CC(=C(C=C1)OC)C(CNC(=O)CN)O,midodrine,0
https://doi.org/10.1038/mi.2013.52,.*does not cross the blood.brain barrier.*," Pretreatment with atropine methyl nitrate (AMN), an mAChR antagonist that does not cross the blood–brain barrier, failed to alter the beneficial effects of GAL on colitis (Figure 3)",Duplicate,C[N+]1(C2CCC1CC(C2)OC(=O)C(CO)C3=CC=CC=C3)C.[N+](=O)([O-])[O-],atropine methyl nitrate,0
https://doi.org/10.1016/S0893-133X(99)00083-4,.*does not cross the blood.brain barrier.*,"In order to determine if the effects of scopolamine observed in Experiment 1 were due to action in the central nervous system, we examined the effect of pre-training methylscopolamine, which does not cross the blood-brain barrier but remains active peripherally (Brown 1993)",Duplicate,C[N+]1([C@@H]2CC(C[C@H]1[C@H]3[C@@H]2O3)OC(=O)[C@H](CO)C4=CC=CC=C4)C,methylscopolamine,0
https://doi.org/10.1038/ncomms10068,.*does not cross the blood.brain barrier.*," Nevertheless, although MMC is used in the clinic for other cancers, it does not cross the blood–brain barrier and has not been used for GBM",Pass,CC1=C(C(=O)C2=C(C1=O)N3C[C@H]4[C@@H]([C@@]3([C@@H]2COC(=O)N)OC)N4)N,MMC,0
https://doi.org/10.1186/1742-2094-11-11,.*does not cross the blood.brain barrier.*," MIF does not cross the blood brain barrier [87, 88], and differential expression in the two areas may explain the differing observations",Pass,-,MIF,0
https://doi.org/10.1007/s12630-013-0064-y,.*does not cross the blood.brain barrier.*,"23 As glycopyrrolate does not cross the blood-brain barrier,16 it might not affect the cholinergic pathways at the central nervous system",Duplicate,C[N+]1(CCC(C1)OC(=O)C(C2CCCC2)(C3=CC=CC=C3)O)C.[Br-],glycopyrrolate,0
https://doi.org/10.1038/hr.2009.115,.*does not cross the blood.brain barrier.*,"Midodrine does not cross the blood–brain barrier and, therefore, does not directly influence central nervous control of the cardiovascular system",Duplicate,COC1=CC(=C(C=C1)OC)C(CNC(=O)CN)O,Midodrine,0
https://doi.org/10.1038/cddis.2013.430,.*does not cross the blood.brain barrier.*,"2 The current therapeutic strategy, enzyme replacement therapy (ERT),3, 4, 5 is effective in peripheral organs but cannot treat brain deterioration because the recombinant enzyme does not cross the blood–brain barrier",Fail,-,,
https://doi.org/10.1038/s41420-020-0237-8,.*does not cross the blood.brain barrier.*,"MLN4924 does not cross the blood brain barrier, but IVT chemotherapy is now standard-of-care in several centers29",Pass,-,MLN4924,0
https://doi.org/10.1186/2051-5960-1-66,.*inability to cross the blood.brain barrier.*," R-spondin proteins hold limited potential as imaging or therapeutic agents in medulloblastoma due to their large size (35 kDa) [46] and likely inability to cross the blood–brain barrier [47, 48]",Fail,-,,
https://doi.org/10.1038/srep23723,.*does not cross the blood.brain barrier.*," Studies with rats exhibited that dietary-supplemented NAA is bioavailable30, but neither evokes systemic toxicity nor adverse effects on the CNS30,31 as NAA does not cross the blood brain barrier30,32",Pass,C1=CC=C2C(=C1)C=CC=C2CC(=O)O,NAA,0
https://doi.org/10.1186/2040-2384-2-5,.*does not cross the blood.brain barrier.*," Because MNTX does not cross the blood-brain barrier, it could play a therapeutic role in reversing the peripheral effects of opiates in palliative care, especially for patients taking high doses of opiates for analgesia [32–37]",Pass,-,MNTX,0
https://doi.org/10.1038/npp.2013.75,.*does not cross the blood.brain barrier.*,"In this study, we used cocaine methiodide (MI), a cocaine analog that does not cross the blood–brain barrier (Wise et al, 2008), to differentiate the peripheral and central effects of cocaine in animals trained to self-administer intravenous cocaine HCl (the addictive form) by lever-pressing",Duplicate,C[N+]1([C@H]2CC[C@@H]1[C@H]([C@H](C2)OC(=O)C3=CC=CC=C3)C(=O)OC)C.[I-],cocaine methiodide,0
https://doi.org/10.1038/npp.2015.248,.*does not cross the blood.brain barrier.*," We tested this hypothesis using the acquisition of a new instrumental seeking response for conditioned reinforcement (ANR), and by comparing the effects of administering at reactivation the lipophilic β-adrenergic receptor antagonist propranolol vs the hydrophilic (lipophobic) β-adrenergic receptor antagonist nadolol, which does not cross the blood–brain barrier",Pass,CC(C)(C)NCC(COC1=CC=CC2=C1C[C@@H]([C@@H](C2)O)O)O,nadolol,0
https://doi.org/10.1038/sj.npp.1300163,.*does not cross the blood.brain barrier.*," To evaluate the possibility that peripheral effects of PRO could be a factor in water maze performance nadolol (NAD; a hydrophilic β-adrenergic antagonist that does not cross the blood–brain barrier effectively, Schiff and Saxey, 1984) was administered to certain groups (see Table 1)",Pass,-,NAD,0
https://doi.org/10.1007/s12325-021-01766-y,.*does not cross the blood.brain barrier.*," Naldemedine, which is structurally similar to naltrexone but does not cross the blood–brain barrier, has been investigated in phase IIb and III trials in patients with cancer and OIC [60]",Pass,CC(C)(C1=NC(=NO1)C2=CC=CC=C2)NC(=O)C3=C([C@H]4[C@@]56CCN([C@@H]([C@@]5(C3)O)CC7=C6C(=C(C=C7)O)O4)CC8CC8)O,Naldemedine,0
https://doi.org/10.1007/s12325-021-01766-y,.*does not cross the blood.brain barrier.*,"Naloxegol, the first orally administered PAMORA approved for the treatment of OIC, is a pegylated form of naloxone that does not cross the blood–brain barrier [60, 151] and is thus preferentially active at opioid receptors in the GI tract [151]",Pass,COCCOCCOCCOCCOCCOCCOCCO[C@H]1CC[C@]2([C@H]3CC4=C5[C@]2([C@H]1OC5=C(C=C4)O)CCN3CC=C)O,Naloxegol,0
https://doi.org/10.1186/2047-9158-2-13,.*unable to cross the blood.brain barrier.*,"Finally, as ASCs are large cells, unable to cross the blood–brain barrier [44], intracerebral application seems to be superior to intravasal application, as only 1-2% of thus applied cells will reach the central nervous system [52]",Fail,-,,
https://doi.org/10.1186/2008-2231-21-35,.*does not pass through the blood.brain barrier.*," It does not pass through the blood–brain barrier sufficiently, so that is not able to treat CNS infection[8–11]",Fail,-,,
https://doi.org/10.1038/npp.2010.231,.*does not cross the blood.brain barrier.*," To verify the ability of ISO infusion in the PMd to induce OFC through downstream adrenergic activation at peripheral β-adrenoceptors, the rats received saline (n=7) or nadolol 10 mg/kg (n=8)—a β-blocker that does not cross the blood–brain barrier (Cruickshank et al, 1980)—intraperitoneally before ISO 40 nmol conditioning",Duplicate,CC(C)(C)NCC(COC1=CC=CC2=C1C[C@@H]([C@@H](C2)O)O)O,nadolol,0
https://doi.org/10.1007/s11682-010-9098-8,.*does not pass through the blood.brain barrier.*," Nadolol does not pass through the blood-brain barrier while propranolol does, and therefore nadolol has the same peripheral effects without any of the central effects of propranolol",Duplicate,CC(C)(C)NCC(COC1=CC=CC2=C1C[C@@H]([C@@H](C2)O)O)O,Nadolol,0
https://doi.org/10.1007/s40263-013-0054-1,.*unable to cross the blood.brain barrier.*," However, if the dopaminergic medication is unable to cross the blood-brain barrier this risk is very low",Fail,-,,
https://doi.org/10.1007/s40263-013-0054-1,.*does not cross the blood.brain barrier.*," However, over 90 % of administered levodopa is decarboxylated outside the CNS, and this dopamine does not cross the blood–brain barrier",Fail,-,,
https://doi.org/10.1186/1741-7015-11-81,.*unable to pass through the blood.brain barrier.*," For β-secretase (BACE), in addition to having dozens of other substrates, the active site is so large that only compounds with more than 500 molecular weight may efficiently inhibit the enzyme, but then they are unable to pass through the blood-brain barrier (BBB) [17]",Fail,-,,
https://doi.org/10.1007/s00213-007-1015-5,.*does not cross the blood.brain barrier.*," In a third experiment, we tested for the contribution of peripheral β-blockade to the attentional effects seen with propranolol by administering nadolol, a β-blocker that does not cross the blood–brain barrier (BBB)",Duplicate,CC(C)(C)NCC(COC1=CC=CC2=C1C[C@@H]([C@@H](C2)O)O)O,nadolol,0
https://doi.org/10.1038/s41536-021-00175-7,.*does not cross the blood.brain barrier.*," NalM is a non-selective and competitive antagonist of µ- (MOR), δ- (DOR) and κ- (KOR) opioid receptors that is restricted to peripheral tissues as it does not cross the blood–brain barrier",Pass,-,NalM,0
https://doi.org/10.1038/s41598-018-29594-1,.*does not cross the blood.brain barrier.*," The use of naloxone methiodide, which does not cross the blood-brain barrier, and the lack of any effect of opioid treatment on feeding behaviour allow us to exclude involvement of opioid receptors located within the central nervous system and capable of affecting fat pad regeneration through control of food intake and/or energy balance",Pass,C[N+]1(CC[C@]23[C@@H]4C(=O)CC[C@]2([C@H]1CC5=C3C(=C(C=C5)O)O4)O)CC=C.[I-],naloxone methiodide,0
https://doi.org/10.1186/s10194-019-0984-1,.*does not cross the blood.brain barrier.*," Furthermore, Nα-methylhistamine does not cross the blood brain barrier",Pass,CNCCC1=CN=CN1,Nalpha-methylhistamine,0
https://doi.org/10.1186/s41043-015-0032-y,.*unable to cross the blood.brain barrier.*," In rats, by using an opioid antagonist unable to cross the blood-brain barrier (naloxone methobromide), intracerebroventricular (ICV)-injected gluten exorphins stimulated prolactin release through activation of opioid receptors probably also outside the brain",Pass,-,naloxone methobromide,0
https://doi.org/10.1038/bjc.2012.440,.*inability to cross the blood.brain barrier.*," It is interesting to note that prior trastuzumab-based therapy did not correlate with BO metastatic behaviour, although trastuzumab is thought to favour the development of BM owing to its inability to cross the blood-brain barrier (Bendell et al, 2003; Musolino et al, 2011)",Duplicate,-,trastuzumab,0
https://doi.org/10.1186/1742-2094-9-241,.*inability to cross the blood.brain barrier.*," However, most of these compounds failed in either pre-clinical trials or human trials due to their inability to cross the blood-brain barrier or due to limited bioavailability",Fail,-,,
https://doi.org/10.1038/s41598-018-27313-4,.*does not cross the blood.brain barrier.*,"To examine the contribution of peripheral opioid receptors, we used naloxone methiodide (NLXM), an opioid receptor antagonist that does not cross the blood-brain barrier10, in the CCI model",Duplicate,C[N+]1(CC[C@]23[C@@H]4C(=O)CC[C@]2([C@H]1CC5=C3C(=C(C=C5)O)O4)O)CC=C.[I-],naloxone methiodide,0
https://doi.org/10.1007/s13311-012-0150-9,.*does not cross the blood.brain barrier.*," Central administration of hypocretin-1 reverses narcolepsy in animal models [84, 85], but unfortunately the hypocretin peptide does not cross the blood brain barrier, thus a centrally penetrating agonist is needed to be usable",Fail,-,,
https://doi.org/10.1186/s12974-016-0591-x,.*unable to cross the blood.brain barrier.*," The fundamental role of enkephalins in T cell-mediated analgesia was confirmed by using naloxone methiodide, an antagonist of the three classes of opioid receptors unable to cross the blood-brain barrier (Fig",Duplicate,C[N+]1(CC[C@]23[C@@H]4C(=O)CC[C@]2([C@H]1CC5=C3C(=C(C=C5)O)O4)O)CC=C.[I-],naloxone methiodide,0
https://doi.org/10.1186/1744-8069-8-54,.*does not cross the blood.brain barrier.*," Interestingly, Mibefradil does not cross the blood brain barrier in significant concentrations, and is thus devoid of CNS effects [4]",Duplicate,CC(C)[C@H]1C2=C(CC[C@@]1(CCN(C)CCCC3=NC4=CC=CC=C4N3)OC(=O)COC)C=C(C=C2)F,Mibefradil,0
https://doi.org/10.1186/1471-2148-12-112,.*does not cross the blood.brain barrier.*," The lack of affect on the level of acox1 transcripts in the brain of zebrafish fed clofibrate may be due to: (i) clofibrate does not cross the blood brain barrier, or (ii) if clofibrate does cross the blood brain barrier, the acox1 gene is not induced by clofibrate in the brain of zebrafish",Fail,-,,
https://doi.org/10.1186/1471-2369-13-47,.*unable to penetrate the blood.brain barrier.*," In accordance with these findings, it has been reported that peripheral angiotensins were unable to penetrate the blood–brain barrier (BBB) under normal physiological conditions [8]",Fail,-,,
https://doi.org/10.1186/s13195-016-0195-9,.*does not cross the blood.brain barrier.*," However, NGF does not cross the blood-brain barrier, owing to its chemical properties, and requires targeted delivery to the brain to have a biological effect",Pass,C([C@@H]([C@H]([C@H]([C@@H]([C@@H](CO)O)O)O)NC(=O)CO)O)C(=O)C(=O)O,NGF,0
https://doi.org/10.1038/s41598-018-20210-w,.*inability to cross the blood.brain barrier.*, An important barrier towards the study of the role of norepinephrine was its inability to cross the blood-brain barrier16,Pass,C1=CC(=C(C=C1[C@H](CN)O)O)O,norepinephrine,0
https://doi.org/10.1038/cddis.2012.59,.*does not cross the blood.brain barrier.*,"8, 11, 12 Because bFGF does not cross the blood–brain barrier, we used intravenous bFGF as a pharmacological approach to determine the effects of inhibition of endothelial cell apoptosis on apoptosis of neural progenitors after irradiation",Duplicate,-,bFGF,0
https://doi.org/10.1038/npp.2011.139,.*does not cross the blood.brain barrier.*," Lack of rCBV changes in animals receiving nicotine methiodide, a quaternary nicotine analog that does not cross the blood–brain barrier, supports a direct neuronal effect of nicotine rather than an action on the vasculature",Pass,-,nicotine methiodide,0
https://doi.org/10.1038/s41598-020-74346-9,.*unable to penetrate the blood.brain barrier.*," According to a Phase III trial (ENDEAR), nusinersen showed moderate therapeutic effects with delayed disease progression and ventilation timing9, but was unable to penetrate the blood–brain barrier (BBB)",Pass,CC1=CN(C(=O)NC1=O)[C@H]2[C@@H]([C@@H]([C@H](O2)CO)OP(=S)(O)OC[C@@H]3[C@H]([C@H]([C@@H](O3)N4C=C(C(=NC4=O)N)C)OCCOC)OP(=S)(O)OC[C@@H]5[C@H]([C@H]([C@@H](O5)N6C=NC7=C(N=CN=C76)N)OCCOC)OP(=S)(O)OC[C@@H]8[C@H]([C@H]([C@@H](O8)N9C=C(C(=NC9=O)N)C)OCCOC)OP(=S)(O)OC[C@@H]1[C@H]([C@H]([C@@H](O1)N1C=C(C(=O)NC1=O)C)OCCOC)OP(=S)(O)OC[C@@H]1[C@H]([C@H]([C@@H](O1)N1C=C(C(=O)NC1=O)C)OCCOC)OP(=S)(O)OC[C@@H]1[C@H]([C@H]([C@@H](O1)N1C=C(C(=O)NC1=O)C)OCCOC)OP(=S)(O)OC[C@@H]1[C@H]([C@H]([C@@H](O1)N1C=C(C(=NC1=O)N)C)OCCOC)OP(=S)(O)OC[C@@H]1[C@H]([C@H]([C@@H](O1)N1C=NC2=C(N=CN=C21)N)OCCOC)OP(=S)(O)OC[C@@H]1[C@H]([C@H]([C@@H](O1)N1C=C(C(=O)NC1=O)C)OCCOC)OP(=S)(O)OC[C@@H]1[C@H]([C@H]([C@@H](O1)N1C=NC2=C(N=CN=C21)N)OCCOC)OP(=S)(O)OC[C@@H]1[C@H]([C@H]([C@@H](O1)N1C=NC2=C(N=CN=C21)N)OCCOC)OP(=S)(O)OC[C@@H]1[C@H]([C@H]([C@@H](O1)N1C=C(C(=O)NC1=O)C)OCCOC)OP(=S)(O)OC[C@@H]1[C@H]([C@H]([C@@H](O1)N1C=NC2=C1N=C(NC2=O)N)OCCOC)OP(=S)(O)OC[C@@H]1[C@H]([C@H]([C@@H](O1)N1C=C(C(=NC1=O)N)C)OCCOC)OP(=S)(O)OC[C@@H]1[C@H]([C@H]([C@@H](O1)N1C=C(C(=O)NC1=O)C)OCCOC)OP(=S)(O)OC[C@@H]1[C@H]([C@H]([C@@H](O1)N1C=NC2=C1N=C(NC2=O)N)OCCOC)OP(=S)(O)OC[C@@H]1[C@H]([C@H]([C@@H](O1)N1C=NC2=C1N=C(NC2=O)N)OCCOC)O)OCCOC,nusinersen,0
https://doi.org/10.1038/cgt.2009.1,.*unable to cross the blood.brain barrier.*," This suggests that the NT-polyplex was unable to cross the blood–brain barrier, possibly caused by the inability of NT to penetrate the blood–brain barrier",Pass,-,NT-polyplex,0
https://doi.org/10.1007/s12035-011-8219-8,.*inability to cross the blood.brain barrier.*,A major impediment for the clinical use of neurotrophic factors is their inability to cross the blood–brain barrier in therapeutic amounts,Fail,-,,
https://doi.org/10.1038/sj.npp.1300955,.*does not cross the blood.brain barrier.*," Furthermore, by reproducing the blood pressure response to nicotine with a systemic infusion of norepinephrine, a potent vasopressor that does not cross the blood–brain barrier (Tuor et al, 2002), no detectable rCBV changes were detected centrally, thus corroborating the idea that the observed rCBV response is not the predominant result of peripheral vascular changes",Duplicate,C1=CC(=C(C=C1[C@H](CN)O)O)O,norepinephrine,0
https://doi.org/10.1186/1750-1326-6-86,.*inability to cross the blood.brain barrier.*," Utilizing radiolabeled forms of these molecules, however, was not clinically feasible due to their relative inability to cross the blood-brain barrier (BBB) and their low binding affinities for Aβ aggregates",Fail,-,,
https://doi.org/10.1007/s12672-011-0090-6,.*does not cross the blood.brain barrier.*," Features of the IMC-A12 monoclonal antibody relevant to its potential as a cancer therapeutic are that it is specific for the IGF1R receptor, it may induce antibody-dependent cellular cytotoxicity, it is administered intravenously, and while it has a relatively long half-life, it does not cross the blood–brain barrier [3, 4]",Fail,-,,
https://doi.org/10.1038/srep12007,.*does not penetrate the blood.brain barrier.*," Importantly, the data presented here show that ODM-201 does not penetrate the blood-brain barrier and does not increase serum testosterone levels suggesting that it does not stimulate production of androgens via the hypothalamic-pituitary-gonadal axis",Pass,C[C@@H](CN1C=CC(=N1)C2=CC(=C(C=C2)C#N)Cl)NC(=O)C3=NNC(=C3)C(C)O,ODM-201,0
https://doi.org/10.1186/s12929-015-0166-7,.*unable to cross the blood.brain barrier.*," Nevertheless, invasive injection in the SN is the major limitation of NTS-polyplex because is unable to cross the blood–brain barrier (BBB) when injected intravenously [69]",Duplicate,-,NTS-polyplex,0
https://doi.org/10.1038/mp.2014.132,.*does not cross the blood.brain barrier.*," Once released into circulation, OXT does not cross the blood–brain barrier in significant amounts, given that the epithelial tight junctions that form this barrier are generally considered impermeable to large molecules",Pass,CC[C@H](C)[C@H]1C(=O)N[C@H](C(=O)N[C@H](C(=O)N[C@@H](CSSC[C@@H](C(=O)N[C@H](C(=O)N1)CC2=CC=C(C=C2)O)N)C(=O)N3CCC[C@H]3C(=O)N[C@@H](CC(C)C)C(=O)NCC(=O)N)CC(=O)N)CCC(=O)N,OXT,0
https://doi.org/10.1007/s13311-011-0080-y,.*does not cross the blood.brain barrier.*," However, the effect is limited because the GALC protein does not cross the blood brain barrier to reach the CNS",Fail,-,,
https://doi.org/10.1007/s13311-011-0068-7,.*inability to cross the blood.brain barrier.*," This would also circumvent issues associated with classical protein delivery approaches, such as the inability to cross the blood-brain barrier, adverse side effects caused by systemic delivery, and short protein half-life",Fail,-,,
https://doi.org/10.1007/s00415-020-09847-8,.*does not cross the blood.brain barrier.*," Nusinersen, an antisense-oligonucleotide (ASO), does not cross the blood–brain barrier [9]",Duplicate,CC1=CN(C(=O)NC1=O)[C@H]2[C@@H]([C@@H]([C@H](O2)CO)OP(=S)(O)OC[C@@H]3[C@H]([C@H]([C@@H](O3)N4C=C(C(=NC4=O)N)C)OCCOC)OP(=S)(O)OC[C@@H]5[C@H]([C@H]([C@@H](O5)N6C=NC7=C(N=CN=C76)N)OCCOC)OP(=S)(O)OC[C@@H]8[C@H]([C@H]([C@@H](O8)N9C=C(C(=NC9=O)N)C)OCCOC)OP(=S)(O)OC[C@@H]1[C@H]([C@H]([C@@H](O1)N1C=C(C(=O)NC1=O)C)OCCOC)OP(=S)(O)OC[C@@H]1[C@H]([C@H]([C@@H](O1)N1C=C(C(=O)NC1=O)C)OCCOC)OP(=S)(O)OC[C@@H]1[C@H]([C@H]([C@@H](O1)N1C=C(C(=O)NC1=O)C)OCCOC)OP(=S)(O)OC[C@@H]1[C@H]([C@H]([C@@H](O1)N1C=C(C(=NC1=O)N)C)OCCOC)OP(=S)(O)OC[C@@H]1[C@H]([C@H]([C@@H](O1)N1C=NC2=C(N=CN=C21)N)OCCOC)OP(=S)(O)OC[C@@H]1[C@H]([C@H]([C@@H](O1)N1C=C(C(=O)NC1=O)C)OCCOC)OP(=S)(O)OC[C@@H]1[C@H]([C@H]([C@@H](O1)N1C=NC2=C(N=CN=C21)N)OCCOC)OP(=S)(O)OC[C@@H]1[C@H]([C@H]([C@@H](O1)N1C=NC2=C(N=CN=C21)N)OCCOC)OP(=S)(O)OC[C@@H]1[C@H]([C@H]([C@@H](O1)N1C=C(C(=O)NC1=O)C)OCCOC)OP(=S)(O)OC[C@@H]1[C@H]([C@H]([C@@H](O1)N1C=NC2=C1N=C(NC2=O)N)OCCOC)OP(=S)(O)OC[C@@H]1[C@H]([C@H]([C@@H](O1)N1C=C(C(=NC1=O)N)C)OCCOC)OP(=S)(O)OC[C@@H]1[C@H]([C@H]([C@@H](O1)N1C=C(C(=O)NC1=O)C)OCCOC)OP(=S)(O)OC[C@@H]1[C@H]([C@H]([C@@H](O1)N1C=NC2=C1N=C(NC2=O)N)OCCOC)OP(=S)(O)OC[C@@H]1[C@H]([C@H]([C@@H](O1)N1C=NC2=C1N=C(NC2=O)N)OCCOC)O)OCCOC,Nusinersen,0
https://doi.org/10.1007/s12325-019-00923-8,.*does not cross the blood.brain barrier.*," However, given that nusinersen does not cross the blood-brain barrier when delivered systemically and has a median half-life of 163 days, it requires direct delivery into the central nervous system through lifetime repeated intrathecal injections [20]",Duplicate,CC1=CN(C(=O)NC1=O)[C@H]2[C@@H]([C@@H]([C@H](O2)CO)OP(=S)(O)OC[C@@H]3[C@H]([C@H]([C@@H](O3)N4C=C(C(=NC4=O)N)C)OCCOC)OP(=S)(O)OC[C@@H]5[C@H]([C@H]([C@@H](O5)N6C=NC7=C(N=CN=C76)N)OCCOC)OP(=S)(O)OC[C@@H]8[C@H]([C@H]([C@@H](O8)N9C=C(C(=NC9=O)N)C)OCCOC)OP(=S)(O)OC[C@@H]1[C@H]([C@H]([C@@H](O1)N1C=C(C(=O)NC1=O)C)OCCOC)OP(=S)(O)OC[C@@H]1[C@H]([C@H]([C@@H](O1)N1C=C(C(=O)NC1=O)C)OCCOC)OP(=S)(O)OC[C@@H]1[C@H]([C@H]([C@@H](O1)N1C=C(C(=O)NC1=O)C)OCCOC)OP(=S)(O)OC[C@@H]1[C@H]([C@H]([C@@H](O1)N1C=C(C(=NC1=O)N)C)OCCOC)OP(=S)(O)OC[C@@H]1[C@H]([C@H]([C@@H](O1)N1C=NC2=C(N=CN=C21)N)OCCOC)OP(=S)(O)OC[C@@H]1[C@H]([C@H]([C@@H](O1)N1C=C(C(=O)NC1=O)C)OCCOC)OP(=S)(O)OC[C@@H]1[C@H]([C@H]([C@@H](O1)N1C=NC2=C(N=CN=C21)N)OCCOC)OP(=S)(O)OC[C@@H]1[C@H]([C@H]([C@@H](O1)N1C=NC2=C(N=CN=C21)N)OCCOC)OP(=S)(O)OC[C@@H]1[C@H]([C@H]([C@@H](O1)N1C=C(C(=O)NC1=O)C)OCCOC)OP(=S)(O)OC[C@@H]1[C@H]([C@H]([C@@H](O1)N1C=NC2=C1N=C(NC2=O)N)OCCOC)OP(=S)(O)OC[C@@H]1[C@H]([C@H]([C@@H](O1)N1C=C(C(=NC1=O)N)C)OCCOC)OP(=S)(O)OC[C@@H]1[C@H]([C@H]([C@@H](O1)N1C=C(C(=O)NC1=O)C)OCCOC)OP(=S)(O)OC[C@@H]1[C@H]([C@H]([C@@H](O1)N1C=NC2=C1N=C(NC2=O)N)OCCOC)OP(=S)(O)OC[C@@H]1[C@H]([C@H]([C@@H](O1)N1C=NC2=C1N=C(NC2=O)N)OCCOC)O)OCCOC,nusinersen,0
https://doi.org/10.1038/npp.2011.77,.*does not cross the blood.brain barrier.*," To address this, in experiment 6, we administered sotalol, a β-adrenergic receptor antagonist that does not cross the blood–brain barrier (Dahlof, 1981)",Duplicate,CC(C)NCC(C1=CC=C(C=C1)NS(=O)(=O)C)O,Sotalol,0
https://doi.org/10.1038/s41467-020-14845-5,.*unable to cross the blood.brain barrier.*, OT is a hydrophilic cyclic nonapeptide and is unable to cross the blood-brain barrier (BBB) in significant amounts12,Pass,-,OT,0
https://doi.org/10.1007/s40750-014-0010-4,.*does not cross the blood.brain barrier.*," From the bloodstream, oxytocin does not cross the blood–brain barrier, and so probably does not impact the brain directly",Pass,CC[C@H](C)[C@H]1C(=O)N[C@H](C(=O)N[C@H](C(=O)N[C@@H](CSSC[C@@H](C(=O)N[C@H](C(=O)N1)CC2=CC=C(C=C2)O)N)C(=O)N3CCC[C@H]3C(=O)N[C@@H](CC(C)C)C(=O)NCC(=O)N)CC(=O)N)CCC(=O)N,oxytocin,0
https://doi.org/10.1007/s00213-011-2171-1,.*does not cross the blood.brain barrier.*," One way to address this issue is to include an experimental group that is given methyl-scopolamine, a quaternary form of SCOP that has the same receptor binding characteristics but supposedly does not cross the blood–brain barrier when given at an equivalent dose (Evans 1975; Harvey et al",Fail,-,,
https://doi.org/10.1007/s12630-011-9479-5,.*does not cross the blood.brain barrier.*," Several authors have suggested that QX-314 does not cross the blood-brain barrier, or if it does, it does so extremely slowly",Fail,-,,
https://doi.org/10.1038/s41598-017-13109-5,.*does not cross the blood.brain barrier.*," Once released into peripheral circulation, OT does not cross the blood-brain barrier in significant amounts37",Duplicate,-,OT,0
https://doi.org/10.1203/PDR.0b013e318212f562,.*does not cross the blood.brain barrier.*," Peripheral OT does not cross the blood-brain barrier easily, although it is observed in human cerebrospinal fluid (CSF) just minutes after intranasal administration (11)",Duplicate,-,OT,0
https://doi.org/10.1038/sj.mp.4002015,.*does not cross the blood.brain barrier.*,"18, 19, 20, 21 One explanation for these negative results might be the limitation of peripheral administration of OT, as it does not cross the blood–brain barrier in sufficient quantities to affect CNS processes",Duplicate,-,OT,0
https://doi.org/10.1186/s13020-021-00468-5,.*does not penetrate the blood.brain barrier.*,"Paclitaxel does not penetrate the blood–brain barrier and could not accumulate in the central nervous system but will damage the peripheral nervous system, including nerve endings, peripheral nerves, and DRG",Pass,CC1=C2[C@H](C(=O)[C@@]3([C@H](C[C@@H]4[C@]([C@H]3[C@@H]([C@@](C2(C)C)(C[C@@H]1OC(=O)[C@@H]([C@H](C5=CC=CC=C5)NC(=O)C6=CC=CC=C6)O)O)OC(=O)C7=CC=CC=C7)(CO4)OC(=O)C)O)C)OC(=O)C,Paclitaxel,0
