Source,Regular_Expression,Match,Manual_Verification,SMILES,Drug_Name,Class
https://doi.org/10.1007/s12630-013-0064-y,.*does not cross the blood.brain barrier.*,"15 In contrast to atropine, a tertiary amine, glycopyrrolate does not cross the blood-brain barrier and cannot affect the central nervous system",Duplicate,C[N+]1(CCC(C1)OC(=O)C(C2CCCC2)(C3=CC=CC=C3)O)C.[Br-],glycopyrrolate,0
https://doi.org/10.1007/s12630-013-9932-8,.*does not cross the blood.brain barrier.*, Glycopyrrolate (1/4th to 1/5th the dose of neostigmine) is preferred because it does not cross the blood brain barrier and its time course of action matches that of neostigmine better than atropine,Duplicate,C[N+]1(CCC(C1)OC(=O)C(C2CCCC2)(C3=CC=CC=C3)O)C.[Br-],Glycopyrrolate,0
https://doi.org/10.1007/BF03008533,.*does not penetrate the blood.brain barrier.*," Although both glycopyrrolate and atropine inhibit PChE to the same extent, glycopyrrolate should be utilized in patients in whom inhibition of brain PChE or central effects ought to be avoided, since glycopyrrolate does not penetrate the blood-brain barrier",Duplicate,C[N+]1(CCC(C1)OC(=O)C(C2CCCC2)(C3=CC=CC=C3)O)C.[Br-],glycopyrrolate,0
https://doi.org/10.1038/srep25309,.*unable to pass through the blood.brain barrier.*," However, most therapeutic drugs demonstrate only modest or no therapeutic benefits because these drugs are unable to pass through the blood brain barrier (BBB)4",Fail,-,,
https://doi.org/10.1186/s10194-019-0984-1,.*unable to cross the blood.brain barrier.*," Because histamine is unable to cross the blood-brain barrier and H1 receptors are present in the endothelium of cerebral arteries, migraine attacks could have an origin in the walls of intracerebral arteries and not in the brain itself [41]",Pass,C1=C(NC=N1)CCN,histamine,0
https://doi.org/10.1007/s00520-015-3020-2,.*unable to cross the blood.brain barrier.*," However, chemotherapeutic agents are generally unable to cross the blood brain barrier and therefore should theoretically be unable to damage central neurons, strongly implying chemotherapy induces pain via other mechanisms",Fail,-,,
https://doi.org/10.1186/s13023-016-0437-8,.*does not cross the blood.brain barrier.*," Enzyme replacement therapy with laronidase (recombinant human α-L-iduronidase, Aldurazyme®) targets non-neurological manifestations as the recombinant enzyme does not cross the blood-brain barrier",Fail,-,,
https://doi.org/10.1186/1471-2407-11-124,.*does not cross the blood.brain barrier.*," This staining pattern has been described elsewhere [26, 27] and is consistent with the fact that Hoechst 33342 does not cross the blood-brain barrier",Pass,CCOC1=CC=C(C=C1)C2=NC3=C(N2)C=C(C=C3)C4=NC5=C(N4)C=C(C=C5)N6CCN(CC6)C,Hoechst 33342,0
https://doi.org/10.1038/srep23723,.*does not cross the blood.brain barrier.*,"It has been shown that NAA does not cross the blood brain barrier from the peripheral blood stream to the brain31,32",Duplicate,C1=CC=C2C(=C1)C=CC=C2CC(=O)O,NAA,0
https://doi.org/10.1038/mp.2015.87,.*does not cross the blood.brain barrier.*," There is evidence from animal studies that CRP per se, which is produced in the periphery, does not cross the blood–brain barrier under ordinary circumstances; however, high levels of peripheral CRP can increase the blood–brain barrier paracellular permeability by affecting the function of tight junctions",Fail,-,,
https://doi.org/10.1186/s12885-019-6316-7,.*does not cross the blood.brain barrier.*,"Imatinib, the mainstay medical treatment for GIST, does not cross the blood-brain barrier, and as such may offer limited clinical benefit to patients with intracranial metastasis [3]",Pass,CC1=C(C=C(C=C1)NC(=O)C2=CC=C(C=C2)CN3CCN(CC3)C)NC4=NC=CC(=N4)C5=CN=CC=C5,Imatinib,0
https://doi.org/10.1016/S0893-133X(99)00055-X,.*unable to penetrate the blood.brain barrier.*," 1998) as well as by ICV administration of hexamethonium, a nAChR-antagonist unable to penetrate the blood brain barrier (Malin et al",Duplicate,C[N+](C)(C)CCCCCC[N+](C)(C)C,hexamethonium,0
https://doi.org/10.1038/ncomms11017,.*does not cross the blood.brain barrier.*," However, leakage of tail vein-injected cadaverine-Alexa-555, a small tracer that normally does not cross the blood–brain barrier19, was reduced in the Vegfr2Y949F/Y949F gliomas compared with WT at D18, both intratumourally and in the tumour periphery (0–500 μm peritumourally; Fig",Fail,-,,
https://doi.org/10.1038/s41598-020-70290-w,.*does not cross the blood.brain barrier.*," HPβCD does not cross the blood–brain barrier (BBB)5, and HPβCD administration to NPC1 patients uses intrathecal administration via injections into the lumbar cerebrospinal fluid (CSF)6",Pass,-,HPbetaCD,0
https://doi.org/10.1038/s41598-017-14162-w,.*does not cross the blood.brain barrier.*, Histamine released from peripheral mast cells may not be able to affect sleep because peripheral histamine does not cross the blood–brain barrier,Duplicate,C1=C(NC=N1)CCN,histamine,0
https://doi.org/10.1038/s41598-017-13698-1,.*was not able to cross the blood.brain barrier.*," Interestingly, with respect to control animals, no enhance in copper content was detectable in brain, thus suggesting that HydroCuP was not able to cross the blood–brain barrier",Pass,-,HydroCuP,0
https://doi.org/10.1007/s12026-014-8513-4,.*does not cross the blood.brain barrier.*," Hypocretin does not cross the blood–brain barrier well, and although creating brain penetrating agonists for peptide receptor can be challenging, it is likely a matter of time before such compounds become available for treating daytime sleepiness and narcolepsy",Pass,-,Hypocretin,0
https://doi.org/10.1186/s13023-019-1207-1,.*does not cross the blood.brain barrier.*," The improvements in measurable neurocognitive function in some patients, as well as the unsolicited reports of increased alertness and focus in even the most severely affected patients, conflict with our prior notion that HPβCD does not cross the blood brain barrier (BBB) and would therefore not be expected to affect clinically apparent change [74]",Duplicate,-,HPbetaCD,0
https://doi.org/10.1038/pr.2015.207,.*does not cross the blood.brain barrier.*," It has sufficient potency (6), does not cross the blood–brain barrier at therapeutic doses (17), is not photochemically active (14), minimally upregulates HO-1 (15), has a rapid onset of action and is short acting (2–12 h) (18), and does not affect other enzymes (7,19)",Fail,-,,
https://doi.org/10.1007/s00125-015-3795-1,.*inability to cross the blood.brain barrier.*," Furthermore, the large molecular size of albiglutide and its likely inability to cross the blood–brain barrier may also account for the difference in GI tolerability when comparing albiglutide with other members of its class",Fail,-,,
https://doi.org/10.1038/srep21973,.*does not cross the blood.brain barrier.*," These complications relate to the fact that HPβCD does not cross the blood-brain barrier62, with the result that current treatment involves direct administration to CSF",Duplicate,-,HPbetaCD,0
https://doi.org/10.1038/gim.2015.36,.*does not penetrate the blood.brain barrier.*,) enzyme replacement therapy does not affect cognitive impairment because recombinant iduronate-2-sulfatase (idursulfase) does not penetrate the blood–brain barrier at therapeutic concentrations,Fail,-,,
https://doi.org/10.1038/gim.2015.36,.*does not penetrate the blood.brain barrier.*,"Weekly infusions of idursulfase, recombinant human I2S (Elaprase, Shire, Lexington, MA), have been shown to improve some somatic manifestations in MPS II patients,5,6 but the enzyme does not penetrate the blood–brain barrier at therapeutic doses or alter cognitive decline in severe disease",Fail,-,,
https://doi.org/10.1038/srep18218,.*does not cross the blood.brain barrier.*," Our findings have to be regarded with several major limitations in mind: (i) we did not assess whether higher or lower doses of URB694 can affect cardiac function in a dose-dependent fashion, (ii) we did not clarify whether the cardioprotective effects of URB694 are mediated by facilitation of CB1 receptor-mediated AEA signaling at the peripheral and/or central level (for instance, this could be achieved by inhibiting FAAH with an URB694-like molecule that does not cross the blood brain barrier) and (iii) we did not thoroughly investigated the effects of CB1 and CB2 receptor blockade with rimonabant and AM630, respectively, on cardiac function",Fail,-,,
https://doi.org/10.1186/1477-7827-3-10,.*does not cross the blood.brain barrier.*, This is in accordance with previous reports that ICI does not cross the blood-brain barrier [15] and hence does not alter the hormonal profile,Pass,-,ICI,0
https://doi.org/10.1007/s10545-017-0075-x,.*does not cross the blood.brain barrier.*, Intravenously delivered idursulfase does not cross the blood–brain barrier in therapeutic concentrations and would not be expected to address the cognitive aspects of disease directly (Muenzer et al 2006; Muenzer et al 2012),Pass,-,idursulfase,0
https://doi.org/10.1007/s10545-014-9686-7,.*does not cross the blood.brain barrier.*," Because idursulfase does not cross the blood–brain barrier (Boado et al 2013), these improvements are likely due to improved sleep or respiration leading to the children having greater interactions with their environments and are not due to any direct action of the drug upon the brain",Duplicate,-,idursulfase,0
https://doi.org/10.1038/srep16349,.*unable to cross the blood.brain barrier.*, It is unstable and unable to cross the blood-brain barrier14,Fail,-,,
https://doi.org/10.1038/gt.2014.96,.*does not cross the blood.brain barrier.*,"Direct delivery of recombinant IL-10, however, has been found to be impractical because IL-10 does not cross the blood–brain barrier5 and, when given IT, its half-life of elimination in the CSF is 2 h",Pass,-,IL-10,0
https://doi.org/10.1038/srep14944,.*inability to cross the blood.brain barrier.*, The toxicity of anti-prion compounds and their inability to cross the blood-brain barrier has limited their successful application18,Fail,-,,
https://doi.org/10.1007/s10237-015-0662-4,.*unable to cross the blood.brain barrier.*,"Infusion is a procedure during which fluid is injected into the brain, either to administer drugs, which cannot enter from the vasculature as they are unable to cross the blood brain barrier, or to investigate cerebral compliance of the brain",Fail,-,,
https://doi.org/10.1186/s13075-015-0784-1,.*unable to penetrate the blood.brain barrier.*," However, anti-TNF agents are unable to penetrate the blood–brain barrier [69]",Fail,-,,
https://doi.org/10.1186/s13023-017-0635-z,.*does not cross the blood.brain barrier.*," In addition, it is important to note that idursulfase does not cross the blood–brain barrier and so treatment of neurological aspects of the disease remains challenging",Duplicate,-,idursulfase,0
https://doi.org/10.1186/s12876-021-01712-w,.*does not cross the blood.brain barrier.*," Since itopride does not cross the blood brain barrier thus does not exhibit ADEs related to CNS, it also hardly increases prolactin levels and does not prolong the QT interval [16]",Pass,CN(C)CCOC1=CC=C(C=C1)CNC(=O)C2=CC(=C(C=C2)OC)OC,itopride,0
https://doi.org/10.1007/s40262-015-0265-3,.*does not cross the blood.brain barrier.*," Carbidopa reduces peripheral decarboxylation of levodopa to dopamine (which does not cross the blood–brain barrier) and directs more levodopa metabolism towards the catechol-O-methyl transferase (COMT) enzyme pathway (which generates the inactive metabolite, 3-O-methyldopa)",Fail,-,,
https://doi.org/10.1186/1750-1172-6-72,.*does not pass through the blood.brain barrier.*," Unfortunately, options for alleviating the neurological manifestations of MPS II remain limited: intravenously administered idursulfase does not pass through the blood-brain barrier, and experience of intrathecal administration of ERT is restricted to small clinical trials",Duplicate,-,idursulfase,0
https://doi.org/10.1186/s40064-015-1206-1,.*does not cross the blood.brain barrier.*,"Among youngsters, domperidone should be preferred over metoclopramide (Pereira-Monteiro 2009) because it does not cross the blood–brain barrier (Teixeira 2001)",Duplicate,C1CN(CCC1N2C3=C(C=C(C=C3)Cl)NC2=O)CCCN4C5=CC=CC=C5NC4=O,domperidone,0
https://doi.org/10.1186/s40064-015-1206-1,.*does not cross the blood.brain barrier.*,"This case illustrates several important messages in quaternary prevention during migraine management: (1) use of acetaminophen is not based in high-quality evidence and better options exist; (2) among youngsters, domperidone should be preferred over metoclopramide because it does not cross the blood–brain barrier; (3) moderate to severe migraine crisis can be managed with triptans in teenagers over 12 years old; (4) it is important to recognize adverse drug effects; (5) harmful consequences of medical interventions do occur; (6) the school community must be informed about chronic diseases of the young",Duplicate,C1CN(CCC1N2C3=C(C=C(C=C3)Cl)NC2=O)CCCN4C5=CC=CC=C5NC4=O,domperidone,0
https://doi.org/10.1186/s12974-020-01746-z,.*does not cross the blood.brain barrier.*," Infliximab is an anti-TNF-a antibody that does not cross the blood-brain barrier [40], binds to peripheral TNF-a, and reduces peripheral inflammation in rats with MHE or hyperammonemia [9, 10, 22]",Pass,-,Infliximab,0
https://doi.org/10.1007/s15010-014-0611-7,.*does not penetrate the blood.brain barrier.*, Itraconazole does not penetrate the blood–brain barrier,Pass,CCC(C)N1C(=O)N(C=N1)C2=CC=C(C=C2)N3CCN(CC3)C4=CC=C(C=C4)OC[C@H]5CO[C@](O5)(CN6C=NC=N6)C7=C(C=C(C=C7)Cl)Cl,Itraconazole,0
https://doi.org/10.1007/s13311-017-0538-7,.*does not cross the blood.brain barrier.*," Since ivabradine does not cross the blood–brain barrier, a brain-permeable derivative will be necessary for therapeutic action within the central nervous system [200]",Pass,CN(CCCN1CCC2=CC(=C(C=C2CC1=O)OC)OC)C[C@H]3CC4=CC(=C(C=C34)OC)OC,ivabradine,0
https://doi.org/10.1186/s12883-019-1267-9,.*unable to cross the blood.brain barrier.*," In contrast to KYN, KYNA is unable to cross the blood brain barrier (BBB)",Pass,C1=CC=C2C(=C1)C(=O)C=C(N2)C(=O)O,KYNA,0
https://doi.org/10.1038/srep21887,.*unable to cross the blood.brain barrier.*," depression, by increasing muscle kynurenine conversion into kynurenic acid that is unable to cross the blood brain barrier10",Pass,C1=CC=C2C(=C1)C(=O)C=C(N2)C(=O)O,kynurenic acid,0
https://doi.org/10.1186/s40199-015-0120-y,.*does not cross the blood.brain barrier.*," Although lapatinib does not cross the blood–brain barrier, it can reach therapeutic levels in brain tumours and brain metastases [7]",Pass,CS(=O)(=O)CCNCC1=CC=C(O1)C2=CC3=C(C=C2)N=CN=C3NC4=CC(=C(C=C4)OCC5=CC(=CC=C5)F)Cl,lapatinib,0
https://doi.org/10.1038/mp.2015.28,.*does not cross the blood.brain barrier.*,"53 However, the HCN1 antagonist ivabradine, approved in Europe for angina, does not cross the blood–brain barrier",Duplicate,CN(CCCN1CCC2=CC(=C(C=C2CC1=O)OC)OC)C[C@H]3CC4=CC(=C(C=C34)OC)OC,ivabradine,0
https://doi.org/10.1007/s40264-015-0296-6,.*unable to cross the blood.brain barrier.*, PCSK9 inhibitors are antibodies which generally are unable to cross the blood-brain barrier without engineered “shuttle” molecules [22],Fail,-,,
https://doi.org/10.1186/s12891-020-03478-w,.*unable to cross the blood.brain barrier.*,"Activation of skeletal muscle increases secretion of peroxisome proliferator-activated receptor-gamma co-activator-1 alpha 1 [32], which promotes skeletal muscle expression of kynurenine aminotransferase, thereby facilitating transformation of kynurenine into kynurenic acid [33], a metabolism product unable to cross the blood-brain barrier [34]",Duplicate,C1=CC=C2C(=C1)C(=O)C=C(N2)C(=O)O,kynurenic acid,0
https://doi.org/10.1038/ijo.2015.28,.*inability to cross the blood.brain barrier.*," Nevertheless, because these peptides normally regulate food intake directly in the hypothalamus, their anorexigenic potential after peripheral administration is hampered by their inability to cross the blood-brain barrier (BBB) and to reach the target brain receptors",Fail,-,,
https://doi.org/10.1186/s12933-018-0702-3,.*does not cross the blood.brain barrier.*, We did not detect linagliptin under our experimental conditions in agreement with previous published data demonstrating that linagliptin does not cross the blood brain barrier under physiological conditions [55],Pass,CC#CCN1C2=C(N=C1N3CCC[C@H](C3)N)N(C(=O)N(C2=O)CC4=NC5=CC=CC=C5C(=N4)C)C,linagliptin,0
https://doi.org/10.1007/s11832-015-0661-0,.*unable to cross the blood.brain barrier.*, Enzymes are unable to cross the blood–brain barrier so provide no cognitive benefit in severe MPS I,Fail,-,,
https://doi.org/10.1186/s13023-019-1027-3,.*does not cross the blood.brain barrier.*," However, since IV laronidase does not cross the blood-brain barrier, it does not treat the CNS manifestations of MPS I, and thus patients may experience neurocognitive deficits throughout life",Pass,-,laronidase,0
https://doi.org/10.1007/s40800-018-0077-0,.*does not cross the blood.brain barrier.*," At therapeutic doses loperamide does not cross the blood–brain barrier and thus typically does not cause central nervous system effects, including the euphoric effect associated with centrally acting opiates",Pass,CN(C)C(=O)C(CCN1CCC(CC1)(C2=CC=C(C=C2)Cl)O)(C3=CC=CC=C3)C4=CC=CC=C4,loperamide,0
https://doi.org/10.1007/s40262-017-0612-7,.*does not penetrate the blood.brain barrier.*,"04) that inhibits SERT; however, based on nonclinical data, Lu AA39835 does not penetrate the blood–brain barrier (data on file)",Pass,CC1=CC(=C(C=C1)SC2=C(C=CC(=C2)O)N3CCNCC3)C,Lu AA39835,0
https://doi.org/10.1007/s40674-014-0005-0,.*does not cross the blood.brain barrier.*," It is comparable in efficacy to metoclopramide, but the CNS side effects are reduced, as it does not cross the blood-brain barrier",Fail,-,,
https://doi.org/10.1007/s40263-014-0221-z,.*does not cross the blood.brain barrier.*," This potent D2 antagonist does not cross the blood brain barrier, so can reduce peripheral side effects of apomorphine, especially nausea, without mitigating the desired CNS effect",Fail,-,,
https://doi.org/10.1038/gim.2016.223,.*does not penetrate the blood.brain barrier.*," However, because laronidase does not penetrate the blood–brain barrier, hematopoietic cell transplantation (HCT) is recommended for MPS IH in addition to ERT",Duplicate,-,laronidase,0
https://doi.org/10.1186/s13023-015-0344-4,.*does not cross the blood.brain barrier.*," In our case series, both siblings in sibship 4 had a reported ERT compliance rate of 60 %, and the younger sibling experienced progressive joint contractures and cognitive delays similar to the older sibling despite initiating therapy at an earlier age While cognitive function is not believed to be directly affected by ERT in patients with MPS I since laronidase does not cross the blood brain barrier, improvements in somatic disease following ERT may impact results of cognitive testing",Duplicate,-,laronidase,0
https://doi.org/10.1186/1750-1172-7-22,.*does not cross the blood.brain barrier.*," Because intravenously administered laronidase does not cross the blood-brain barrier [18], ERT cannot prevent cognitive decline in patients with MPS I-H",Duplicate,-,laronidase,0
https://doi.org/10.1186/1750-1172-6-55,.*unable to cross the blood.brain barrier.*," Laronidase is unable to cross the blood brain barrier in significant quantity, at least in the recommended dose (100 IU/kg/week) [13], and will therefore not prevent cognitive decline in patients with MPS I-H",Duplicate,-,Laronidase,0
https://doi.org/10.1186/s12974-018-1328-9,.*does not cross the blood.brain barrier.*," Although LPS does not cross the blood-brain barrier at significant levels [20], it could be interacting with juxta-cerebrovascular cells to transmit an immune signal across the barrier",Pass,-,LPS,0
https://doi.org/10.1038/bjc.2014.388,.*inability to cross the blood.brain barrier.*,The incidence of BM in patients with HER2+ MBC increases over time and may be attributable partly to marked reduction in mortality as a result of HER2 inhibition and control of non-CNS metastatic progression and monoclonal antibodies’ inability to cross the blood brain barrier (BBB),Fail,-,,
https://doi.org/10.1038/boneres.2014.34,.*does not cross the blood.brain barrier.*,267 These results suggest that an orally active inhibitor of gut TPH1 that does not cross the blood–brain barrier might be a novel anabolic agent for treating osteoporosis,Fail,-,,
https://doi.org/10.1186/1743-7075-3-15,.*unable to cross the blood.brain barrier.*,"In order for malonyl CoA to function as a regulator of appetite-control feeding behaviours, the presence of the ACC isoform and its regulation in brain is mandatory since malonyl CoA produced in the liver is unable to cross the blood brain barrier",Pass,CC(C)(COP(=O)(O)OP(=O)(O)OC[C@@H]1[C@H]([C@H]([C@@H](O1)N2C=NC3=C(N=CN=C32)N)O)OP(=O)(O)O)[C@H](C(=O)NCCC(=O)NCCSC(=O)CC(=O)O)O,malonyl CoA,0
https://doi.org/10.1038/ijo.2014.14,.*does not cross the blood.brain barrier.*,"As the majority of 5HT body’s pool (95%) is produced by enterochromaffin (EC) cell within the gut (mainly in the antrum and duodenum), and because the gut-derived 5HT does not cross the blood–brain barrier and was suggested to be a multifunctional adapter to starvation,28 we determined whether a gastric leptin—5HT pathway may exist",Fail,-,,
https://doi.org/10.1038/nrdp.2016.14,.*does not cross the blood.brain barrier.*," As loperamide does not cross the blood–brain barrier, central adverse effects are limited",Duplicate,CN(C)C(=O)C(CCN1CCC(CC1)(C2=CC=C(C=C2)Cl)O)(C3=CC=CC=C3)C4=CC=CC=C4,loperamide,0
https://doi.org/10.1007/s10545-014-9686-7,.*does not cross the blood.brain barrier.*," This likely reflects an increased ability of these patients to interact with others and with their environment due to improved mobility, improved sleep, and/or reductions in respiratory disease burden, since idursulfase does not cross the blood–brain barrier (Boado et al 2013)",Duplicate,-,idursulfase,0
https://doi.org/10.1186/1475-2891-13-80,.*unable to cross the blood.brain barrier.*,"However, since central dopamine is unable to cross the blood–brain barrier [25], it is challenging to appropriately measure its activity",Duplicate,C1=CC(=C(C=C1CCN)O)O,dopamine,0
https://doi.org/10.1007/s10620-015-3615-y,.*does not cross the blood.brain barrier.*, Loperamide does not cross the blood–brain barrier and does not have these adverse effects,Duplicate,CN(C)C(=O)C(CCN1CCC(CC1)(C2=CC=C(C=C2)Cl)O)(C3=CC=CC=C3)C4=CC=CC=C4,Loperamide,0
https://doi.org/10.1186/1745-6673-2-16,.*does not cross the blood.brain barrier.*," Loperamide, which does not cross the blood-brain barrier but exerts antinociceptive effects after direct injection into the brain, was loaded into human serum albumin nanoparticles and linked to apolipoprotein E",Duplicate,CN(C)C(=O)C(CCN1CCC(CC1)(C2=CC=C(C=C2)Cl)O)(C3=CC=CC=C3)C4=CC=CC=C4,Loperamide,0
https://doi.org/10.1186/1471-2407-14-543,.*unable to cross the blood.brain barrier.*, These data probably reflect the impossibility to reach a high cerebrospinal fluid drug concentration with the actual cytotoxic agents most active in EOC which are unable to cross the blood–brain barrier,Fail,-,,
https://doi.org/10.1007/s00125-005-1791-6,.*does not cross the blood.brain barrier.*,"After the activation of opioid μ-receptors, tramadol is an effective treatment to handle the pain in clinic with some non-opioid effects [15], while loperamide is a peripheral agonist that does not cross the blood–brain barrier and lacks the side-effects produced by centrally acting opiates [16]",Duplicate,CN(C)C(=O)C(CCN1CCC(CC1)(C2=CC=C(C=C2)Cl)O)(C3=CC=CC=C3)C4=CC=CC=C4,loperamide,0
https://doi.org/10.1203/PDR.0b013e31815b4421,.*does not cross the blood.brain barrier.*," Additionally, bicuculline methiodide (which does not cross the blood brain barrier) was given during hypoxia and did not have an effect on ventilation",Pass,CI,methiodide,0
https://doi.org/10.1007/s40142-014-0038-6,.*inability to cross the blood.brain barrier.*," If performed early enough in the disease course, this has the potential to impact central nervous system disease, a key system otherwise unreachable by peripheral enzyme replacement therapy because of its inability to cross the blood-brain barrier [10]",Fail,-,,
https://doi.org/10.1038/srep25457,.*does not cross the blood.brain barrier.*," However, LPS does not cross the blood–brain barrier (BBB)6",Duplicate,-,LPS,0
https://doi.org/10.1038/ncomms5486,.*does not cross the blood.brain barrier.*," Since LPS does not cross the blood–brain barrier36, its mode of action in our model is via the activation of TLR4 on the luminal surface of brain blood vessels",Duplicate,-,LPS,0
https://doi.org/10.1186/s12904-019-0416-7,.*does not cross the blood.brain barrier.*," As an alternative methylnaltrexone, a quaternary amine of naltrexone that does not cross the blood-brain barrier, can be prescribed",Pass,C[N+]1(CC[C@]23[C@@H]4C(=O)CC[C@]2([C@H]1CC5=C3C(=C(C=C5)O)O4)O)CC6CC6,methylnaltrexone,0
https://doi.org/10.1007/s12094-013-1110-5,.*unable to cross the blood.brain barrier.*," Moreover, the brain may represent a preferential site of metastasis as many of the currently available therapies are unable to cross the blood–brain barrier (BBB), even if this barrier is disrupted by tumor invasion",Fail,-,,
